{
  "$schema": "https://json-schema.org/draft/2020-12/schema",
  "$id": "https://detran.example.invalid/schemas/availability-manifest.schema.json",
  "title": "Availability Manifest",
  "description": "Manifesto de disponibilidade por superfície (C-0002; work/rounds/R-0030/availability-manifest.schema.md). Descreve o código mesclado; o gate tools/docs/user-docs/check.mjs confere rota × código × selo × manual.",
  "type": "object",
  "additionalProperties": false,
  "required": [
    "schemaVersion",
    "surface",
    "hostApp",
    "package",
    "measuredAt",
    "routeSources",
    "routes",
    "history"
  ],
  "properties": {
    "$schema": {
      "type": "string"
    },
    "schemaVersion": {
      "const": "1.0.0"
    },
    "surface": {
      "enum": [
        "rait-web",
        "dashboard-web",
        "portal-web",
        "boat",
        "teat-web",
        "teat-mobile",
        "pec-web"
      ]
    },
    "hostApp": {
      "type": "string",
      "pattern": "^apps/[a-z]+/(web|mobile)$"
    },
    "package": {
      "type": "string",
      "pattern": "^@detran/[a-z-]+$"
    },
    "measuredAt": {
      "type": "string",
      "pattern": "^[0-9a-f]{40}$"
    },
    "routeSources": {
      "type": "array",
      "minItems": 1,
      "items": {
        "type": "string"
      }
    },
    "routes": {
      "type": "array",
      "minItems": 1,
      "items": {
        "$ref": "#/$defs/route"
      }
    },
    "history": {
      "type": "array",
      "minItems": 1,
      "items": {
        "type": "object",
        "additionalProperties": false,
        "required": ["round", "date", "note"],
        "properties": {
          "round": {
            "type": "string",
            "pattern": "^R-[0-9]{4}$"
          },
          "date": {
            "type": "string",
            "format": "date"
          },
          "note": {
            "type": "string",
            "minLength": 1
          }
        }
      }
    }
  },
  "$defs": {
    "seal": {
      "enum": [
        "disponivel",
        "parcial",
        "homologacao",
        "indisponivel_nesta_versao",
        "bloqueado_por_decisao"
      ]
    },
    "decision": {
      "type": ["string", "null"],
      "pattern": "^(OD|DT|ADR)-[A-Za-z0-9-]+$"
    },
    "profile": {
      "enum": [
        "cidadao",
        "agente-transito",
        "colegiado-secretaria",
        "operador",
        "gestor",
        "auditor-dpo",
        "administrador",
        "clinico",
        "regulatorio"
      ]
    },
    "route": {
      "type": "object",
      "additionalProperties": false,
      "required": [
        "id",
        "path",
        "kind",
        "screen",
        "module",
        "audience",
        "roles",
        "profiles",
        "level",
        "seal",
        "decision",
        "help",
        "evidence"
      ],
      "properties": {
        "id": {
          "type": "string",
          "pattern": "^[a-z-]+:.*$"
        },
        "path": {
          "type": "string"
        },
        "host": {
          "type": "string",
          "pattern": "^apps/[a-z]+/(web|mobile)$"
        },
        "kind": {
          "enum": ["tela", "auxiliar"]
        },
        "screen": {
          "type": ["string", "null"],
          "pattern": "^IU-[A-Z0-9-]+$"
        },
        "module": {
          "type": "string",
          "minLength": 1
        },
        "audience": {
          "enum": ["publico", "cidadao", "interno"]
        },
        "roles": {
          "type": "array",
          "uniqueItems": true,
          "items": {
            "type": "string"
          }
        },
        "profiles": {
          "type": "array",
          "uniqueItems": true,
          "items": {
            "$ref": "#/$defs/profile"
          }
        },
        "level": {
          "enum": ["L0", "L1", "L2"]
        },
        "seal": {
          "$ref": "#/$defs/seal"
        },
        "decision": {
          "$ref": "#/$defs/decision"
        },
        "actions": {
          "type": "array",
          "items": {
            "type": "object",
            "additionalProperties": false,
            "required": ["id", "operationId", "seal", "decision"],
            "properties": {
              "id": {
                "type": "string",
                "minLength": 1
              },
              "operationId": {
                "type": ["string", "null"]
              },
              "seal": {
                "$ref": "#/$defs/seal"
              },
              "decision": {
                "$ref": "#/$defs/decision"
              }
            }
          }
        },
        "help": {
          "type": "object",
          "additionalProperties": false,
          "required": ["entry", "key"],
          "properties": {
            "entry": {
              "enum": ["nenhum", "atalhos", "pagina", "link"]
            },
            "key": {
              "type": ["string", "null"]
            }
          }
        },
        "evidence": {
          "type": "object",
          "additionalProperties": false,
          "required": ["files", "tests"],
          "properties": {
            "files": {
              "type": "array",
              "minItems": 1,
              "items": {
                "type": "string"
              }
            },
            "tests": {
              "type": "array",
              "items": {
                "type": "string"
              }
            }
          }
        }
      }
    }
  }
}
