{
  "$schema": "../../schemas/availability-manifest.schema.json",
  "schemaVersion": "1.0.0",
  "surface": "teat-web",
  "hostApp": "apps/teat/web",
  "package": "@detran/teat-web",
  "measuredAt": "0000000000000000000000000000000000000000",
  "routeSources": ["apps/teat/web/src/app/app.route-manifest.ts"],
  "routes": [
    {
      "id": "teat-web:painel",
      "path": "painel",
      "kind": "tela",
      "screen": "IU-TEST-T01",
      "module": "painel",
      "audience": "interno",
      "roles": ["processing-operator"],
      "profiles": ["operador"],
      "level": "L2",
      "seal": "disponivel",
      "decision": null,
      "actions": [],
      "help": {
        "entry": "nenhum",
        "key": null
      },
      "evidence": {
        "files": [
          "apps/teat/web/src/app/app.route-manifest.ts",
          "docs/framework/product/shared/screens/IU-TEST-T01.md"
        ],
        "tests": ["tools/docs/user-docs/tests/availability.test.mjs"]
      }
    }
  ],
  "history": [
    {
      "round": "R-0030",
      "date": "2026-09-29",
      "note": "Fixture positiva."
    }
  ]
}
